{
  "schema_version": "1.0",
  "practice_id": "practice-public-demo-001",
  "manifest_id": "manifest-public-demo-001",
  "subject": "mathematics",
  "topic": "epsilon-delta continuity",
  "questions_attempted": 7,
  "questions_correct": 5,
  "questions_incorrect": 2,
  "score": 0.7142857142857143,
  "mistakes": [{"type": "quantifier-order"}],
  "weakness_tags": ["quantifier-order"],
  "open_questions": ["How does uniform continuity change the quantifiers?"],
  "hints_used": 1,
  "mastery_before": 1,
  "mastery_after": 2,
  "mastery_reason": "guided successful performance",
  "difficulty": "medium",
  "started_at": "2026-01-01T11:45:00Z",
  "completed_at": "2026-01-01T12:00:00Z",
  "engine": "gallop-demo",
  "integration_test": true,
  "metadata": {"synthetic": true}
}

